,2010.0,2011.0,2012.0,2013.0,2014.0,2015.0,2016.0,2017.0,2018.0,,2010.0,2011.0,2012.0,2013.0,2014.0,2015.0,2016.0,2017.0,2018.0,
PIB. Precios corrientes,0.37,-1.67,-3.61,-2.49,1.63,2.23,3.33,3.85,4.35,,0.32,-0.83,-3.07,-1.04,1.16,4.4,3.36,4.31,3.47,
PIB. Índices de volumen,-0.18,-2.33,-2.52,-3.16,1.39,2.35,2.66,2.75,2.83,,0.16,-0.81,-2.96,-1.44,1.38,3.84,3.03,2.89,2.35,
PIB per cápita,-0.11,-1.99,-3.53,-2.07,2.03,2.69,3.71,3.94,4.35,,-0.1,-1.2,-3.13,-0.68,1.46,4.51,3.27,4.13,3.04,
Gasto sanitario público consolidado. Sector CC.AA,36.39,-23.42,0.11,3.14,1.82,0.9,5.46,,,,-5.72,-3.85,0.6,6.39,1.48,3.08,3.73,,,
Gasto sanitario público consolidado per cápita. Sector CC.AA,36.5,-23.09,0.5,3.62,2.19,0.99,5.45,,,,-5.77,-3.49,0.9,6.49,1.39,2.89,3.29,,,
Gasto sanitario público consolidado sobre el PIB. Sector CC.AA,41.49,-21.47,-1.5,0.89,-1.46,-2.84,1.06,,,,-2.76,-2.82,-0.56,1.9,-1.84,-1.2,0.25,,,
Ingresos tributarios netos anuales,17.81,-10.83,7.4,8.13,-28.45,16.42,-5.6,53.33,-12.27,-29.5,10.77,1.39,4.21,0.17,3.64,4.01,2.33,4.14,7.6,1.98
