Categoria,Cantabria - 2T-19,Cantabria - 3T-19,Cantabria - 4T-19,Cantabria - 1T-20,Cantabria – 2T-20, - Indicadores,España - 2T-19,España - 3T-19,España - 4T-19,España - 1T-20,España – 2T-20
Economía,,,,,,Deuda,,,,,
Economía,,,,,,Deuda sobre el PIB,,,,,
Empresas y establecimientos,-1.69,-0.55,-1.18,-3.08,-27.67,Índice de confianza empresarial,-1.92,-0.88,-2.09,-1.43,-28.14
Mercado de Trabajo,,,,,,EPA. Ocupados,,,,,
Mercado de Trabajo,,,,,,EPA. Parados,,,,,
Mercado de Trabajo,,,,,,EPA. Tasa de Empleo,,,,,
Mercado de Trabajo,,,,,,EPA. Tasa de paro,,,,,
Servicios,,,,,,Transporte de mercancías por carretera,,,,,
