Categoria,Cantabria - 2014,Cantabria - 2015,Cantabria - 2016,Cantabria - 2017,Cantabria - 2018, - Indicadores,España - 2014,España - 2015,España - 2016,España - 2017,España - 2018
Economía,1.63,2.23,3.33,3.85,4.35,PIB. Precios corrientes,1.16,4.4,3.36,4.31,3.47
Economía,1.39,2.35,2.66,2.75,2.83,PIB. Indices de volumen,1.38,3.84,3.03,2.89,2.35
Economía,2.03,2.69,3.71,3.94,4.35,PIB per cápita,1.46,4.51,3.27,4.13,3.04
Sanidad,0.11,3.14,1.82,0.9,5.46,Gasto sanitario público consolidado. Sector CC.AA,0.6,6.39,1.48,3.08,3.73
Sanidad,0.5,3.62,2.19,0.99,5.45,Gasto sanitario público consolidado per cápita. Sector CC.AA,0.9,6.49,1.39,2.89,3.29
Sanidad,,,,,,Gasto sanitario público consolidado sobre el PIB. Sector CC.AA,,,,,
